id,brand,name,group_brand,group
1,휘슬,휘슬 리얼블랙 프리미엄 강아지 배변패드 소형 표준형 50매 2개 660991,휘슬 리얼블랙 프리미엄 강아지 배변패드 소형 표준형 50매 2개 660991,휘슬_휘슬 리얼블랙 프리미엄 강아지 배변패드 소형 표준형 50매 2개 660991
2,홈플러스시그니처,홈플러스시그니처 깔끔해서 좋은 배변패드 중형 100매,홈플러스시그니처 깔끔해서 좋은 배변패드 중형 100매,홈플러스시그니처_홈플러스시그니처 깔끔해서 좋은 배변패드 중형 100매
3,호랑이,[1개/4개] 호랑이패드 울트라형 (50매),울트라형,호랑이_울트라형
4,호랑이,호랑이 블랙패드 중형 50매 (42x52cm),블랙패드,호랑이_블랙패드
5,호랑이,호랑이패드 강아지 흡수력 좋은 대형 배변 패드 60매(60X76),대형패드,호랑이_대형패드
6,호랑이,호랑이패드 강아지 흡수력 좋은 중형 배변 패드 200매(42X52),블랙패드,호랑이_블랙패드
7,호랑이,호랑이패드 강아지 흡수력 좋은 울트라형 대형 배변 패드 50매(76X90),울트라형,호랑이_울트라형
8,헬로키티,헬로키티 애견패드 골라담기,헬로키티 애견패드 골라담기,헬로키티_헬로키티 애견패드 골라담기
9,헬로도기,헬로도기 헬로패드100매(라벤더향),헬로도기 헬로패드100매(라벤더향),헬로도기_헬로도기 헬로패드100매(라벤더향)
10,향그린,마이도기 향그린 패드 35g 50매,항그랜패드,향그린_항그랜패드
11,향그린,마이도기 향그린 패드 35g 50매 x 4개 1박스,항그랜패드,향그린_항그랜패드
12,한장뚝딱,한장뚝딱 라이트 강아지 애견 패드 120매 72g,강아지패드72g,한장뚝딱_강아지패드72g
13,한장뚝딱,한장뚝딱 라이트 20g x 400매 강아지 배변패드,강아지패드20g,한장뚝딱_강아지패드20g
14,한장뚝딱,한장뚝딱 라이트 20g x 400매 강아지 배변패드,강아지패드20g,한장뚝딱_강아지패드20g
15,한장뚝딱,한장뚝딱 라이트 강아지패드 20g 100매 x 4개,강아지패드20g,한장뚝딱_강아지패드20g
16,한장뚝딱,한장뚝딱 라이트 20g x 400매 강아지 배변pad,강아지패드20g,한장뚝딱_강아지패드20g
17,한장뚝딱,한장뚝딱 라이트 강아지 배변 패드 대형 120매 72g,강아지패드72g,한장뚝딱_강아지패드72g
18,한장뚝딱,한장뚝딱 라이트 강아지 배변 패드 대형 120매 72g,강아지패드72g,한장뚝딱_강아지패드72g
19,한장뚝딱,한장뚝딱 라이트 강아지패드 72g 120매 30매X4개,강아지패드72g,한장뚝딱_강아지패드72g
20,한장뚝딱,한장뚝딱 라이트 강아지패드 20g 400매 100매X4개,강아지패드20g,한장뚝딱_강아지패드20g
21,핏펫,[핏펫] 닥터설 논슬립 강아지 배변패드 대형 20매 3팩 세트 애견 관절 보호,닥터설패드,핏펫_닥터설패드
22,핏펫,핏펫 [1+1] 가성비짱 흡수력 좋은 국내생산 무무 배변패드 대형 20매+20매,닥터설패드,핏펫_닥터설패드
23,피피픽,피피픽 제로그레이패드 흡수력 좋은 강아지 무향 숯 배변패드,피피픽 제로그레이패드 흡수력 좋은 강아지 무향 숯 배변패드,피피픽_피피픽 제로그레이패드 흡수력 좋은 강아지 무향 숯 배변패드
24,프리미요,강아지 간식 중소형견 배변패드 100매 자견 3개월이상 애견,중소형견패드,프리미요_중소형견패드
25,프리미요,"프리미요댕댕이 배변패드 100매 45x55 , 강아지배변패드",중소형견패드,프리미요_중소형견패드
26,프로도기,프로도기 노스멜패드 중형 실속팩 60매,노스멜패드_중형_60매,프로도기_노스멜패드_중형_60매
27,프로도기,프로도기 노스멜패드 대형 실속팩 60매,노스멜패드_대형_60매,프로도기_노스멜패드_대형_60매
28,프로도기,프로도기 트레이닝패드 대형 실속팩 60매,트레이닝패드,프로도기_트레이닝패드
29,프로도기,프로도기 트레이닝패드 대형 실속팩 60매,트레이닝패드,프로도기_트레이닝패드
30,프로도기,프로도기 노스멜 패드 소형 그린티향 50매,노스멜패드,프로도기_노스멜패드
31,프로도기,프로도기 퍼펙션 패드 소형 캐모마일향 30매,퍼팩션패드,프로도기_퍼팩션패드
32,프로도기,프로도기 퍼펙션 패드 소형 베이비파우더향 30매,퍼팩션패드,프로도기_퍼팩션패드
33,프로도기,프로도기 노스멜 패드 소형 베이비파우더향 50매,노스멜패드,프로도기_노스멜패드
34,프로도기,프로도기 노스멜 패드 소형 그린티향 50매 2개 묶음,노스멜패드,프로도기_노스멜패드
35,프로도기,프로도기 노스멜 패드 소형 그린티향 50매 8개 묶음,노스멜패드,프로도기_노스멜패드
36,프로도기,프로도기 노스멜 패드 소형 그린티향 50매 4개 묶음,노스멜패드,프로도기_노스멜패드
37,프로도기,프로도기 퍼펙션 패드 소형 캐모마일향 30매 8개 묶음,퍼팩션패드,프로도기_퍼팩션패드
38,프로도기,프로도기 퍼펙션 패드 소형 베이비파우더향 30매 4개 묶음,퍼팩션패드,프로도기_퍼팩션패드
39,프로도기,프로도기 노스멜 패드 소형 베이비파우더향 50매 2개 묶음,노스멜패드,프로도기_노스멜패드
40,프로도기,프로도기 퍼펙션 패드 소형 베이비파우더향 30매 8개 묶음,퍼팩션패드,프로도기_퍼팩션패드
41,프로도기,프로도기 노스멜 패드 소형 베이비파우더향 50매 4개 묶음,노스멜패드,프로도기_노스멜패드
42,프로도기,프로도기 노스멜 패드 소형 베이비파우더향 50매 8개 묶음,노스멜패드,프로도기_노스멜패드
43,프로도기,프로도기 강아지 배변패드 대형 노스멜 애견패드 그린티향 30매,노스멜패드,프로도기_노스멜패드
44,프로도기,프로도기 애견패드 노스멜 강아지패드 중형 50매 베이비파우더향,노스멜패드,프로도기_노스멜패드
45,프로도기,프로도기 배변유도패드 트레이닝 배변훈련 패드 대형 대용량 120매,트레이닝패드,프로도기_트레이닝패드
46,프로도기,프로도기 (현대Hmall) [프로도기] 노스멜패드 XL 대형 30매,노스멜패드_대형_30매,프로도기_노스멜패드_대형_30매
47,프로도기,프로도기 강아지 대형패드 노스멜 배변패드 베이비파우더향 대용량 120매,노스멜패드_대형_30매,프로도기_노스멜패드_대형_30매
48,프로도기,프로도기 애견 배변패드 대형 노스멜 강아지대형패드 베이비파우더향 30매,노스멜패드_대형_30매,프로도기_노스멜패드_대형_30매
49,프로도기,프로도기 배변패드 노스멜 강아지 애견패드 중형 200매 그린티향 대용량,노스멜패드,프로도기_노스멜패드
50,프로도기,프로도기 배변유도패드 트레이닝 아기강아지 퍼피 배변훈련 패드 중형 30매,트레이닝패드,프로도기_트레이닝패드
51,프로도기,프로도기 배변패드 노스멜 강아지 애견 패드 중형 200매 베이비파우더향 대용량,노스멜패드,프로도기_노스멜패드
52,프로도기,프로도기 (현대Hmall) [프로도기] 노스멜패드 L 중형 200매 대용량 패키지,노스멜패드,프로도기_노스멜패드
53,프로도기,프로도기 배변유도패드 트레이닝 아기강아지 퍼피 배변훈련 패드 중형 30매 4개 묶음,트레이닝패드,프로도기_트레이닝패드
54,프로도기,프로도기 냄새제거 노스멜 배변패드 L 50매,노스멜패드,프로도기_노스멜패드
55,프로도기,프로도기 냄새제거 노스멜 배변패드 XL 30매,노스멜패드_대형_30매,프로도기_노스멜패드_대형_30매
56,프로도기,프로도기 트레이닝 배변패드 XL 30매,트레이닝패드,프로도기_트레이닝패드
57,프로도기,프로도기 트레이닝 배변패드 L 30매,트레이닝패드,프로도기_트레이닝패드
58,프로도기,프로도기 퍼펙션 배변패드 베이비파우더향 XXL 20매,퍼팩션패드_초대형_20매,프로도기_퍼팩션패드_초대형_20매
59,프로도기,프로도기 퍼펙션 배변패드 카모마일향 XXL 20매,퍼팩션패드_초대형_20매,프로도기_퍼팩션패드_초대형_20매
60,프로도기,프로도기 아로마 배변패드 화이트머스크 M 50매,아로마패드_50매_중형,프로도기_아로마패드_50매_중형
61,프로도기,프로도기 아로마 배변패드 샌들우드 M 50매,아로마패드_50매_중형,프로도기_아로마패드_50매_중형
62,프로도기,프로도기 아로마 배변패드 히노끼 M 50매,아로마패드_50매_중형,프로도기_아로마패드_50매_중형
63,프로도기,프로도기 아로마 배변패드 히노키 소형 M 50매,아로마패드_50매_중형,프로도기_아로마패드_50매_중형
64,프로도기,프로도기 퍼펙션 배변패드 카모마일향 XL 20매,퍼팩션패드_초대형_20매,프로도기_퍼팩션패드_초대형_20매
65,프로도기,프로도기 퍼펙션 배변패드 베이비파우더향 XL 20매,퍼팩션패드_초대형_20매,프로도기_퍼팩션패드_초대형_20매
66,프로도기,프로도기 노스멜 배변패드 베이비파우더향 XL 30매,노스멜패드_대형_30매,프로도기_노스멜패드_대형_30매
67,프로도기,프로도기 노스멜 배변패드 그린티향 XL 30매,노스멜패드_대형_30매,프로도기_노스멜패드_대형_30매
68,프로도기,프로도기 노스멜 배변패드 베이비파우더향 XL 120매,노스멜패드_대형_30매,프로도기_노스멜패드_대형_30매
69,프로도기,프로도기 노스멜 배변패드 그린티향 XL 120매,노스멜패드_대형_30매,프로도기_노스멜패드_대형_30매
70,프로도기,프로도기 노스멜 배변패드 베이비파우더향 L 50매,노스멜패드,프로도기_노스멜패드
71,프로도기,프로도기 트레이닝 배변패드 XL 120매,트레이닝패드,프로도기_트레이닝패드
72,프로도기,프로도기 노스멜 배변패드 그린티향 L  200매,노스멜패드,프로도기_노스멜패드
73,프로도기,프로도기 노스멜 배변패드 베이비파우더향 L 200매,노스멜패드,프로도기_노스멜패드
74,프로도기,프로도기 노스멜 배변패드 그린티향 L 50매,노스멜패드,프로도기_노스멜패드
75,프로도기,프로도기 피크닉 배변패드 S 30매,피크닉 배변패드,프로도기_피크닉 배변패드
76,프로도기,프로도기 아로마 배변패드 화이트머스크 XL 30매,아로마패드,프로도기_아로마패드
77,프로도기,프로도기 아로마 배변패드 히노끼 XL 30매,아로마패드,프로도기_아로마패드
78,프로도기,프로도기 아로마 배변패드 히노키 XL 30매,아로마패드,프로도기_아로마패드
79,프로도기,프로도기 아로마 배변패드 샌들우드 XL 30매,아로마패드,프로도기_아로마패드
80,프로도기,프로도기 노스멜 배변패드 M 50매,노스멜패드,프로도기_노스멜패드
81,프로도기,프로도기 99% 냄새제거 노스멜 배변패드 소형 200매 (50매 x 4팩) 배변매트 배변훈련,노스멜패드,프로도기_노스멜패드
82,프로도기,프로도기 배변유도제 함유 트레이닝 강아지 배변패드 XL 특대형 (30매),트레이닝패드,프로도기_트레이닝패드
83,프로도기,프로도기 99% 냄새제거 노스멜 강아지 배변패드 중형 대용량 (200매),노스멜패드,프로도기_노스멜패드
84,프로도기,프로도기 99% 냄새제거 노스멜 강아지 배변패드 대형 대용량 (120매),노스멜패드_대형_30매,프로도기_노스멜패드_대형_30매
85,프로도기,프로도기 3가지향으로 악취커버 아로마 배변패드 M 200매 (50매 x 4팩),아로마패드_50매_중형,프로도기_아로마패드_50매_중형
86,프로도기,프로도기 3가지향으로 악취커버 아로마 배변패드 M (50매),아로마패드,프로도기_아로마패드
87,프로도기,프로도기 3가지향으로 악취커버 아로마 배변패드 M 300매 (50매 x 6팩),아로마패드_50매_중형,프로도기_아로마패드_50매_중형
88,프로도기,프로도기 최대 7L 흡수 퍼펙션 배변패드 XXL 80매 (20매 x 4팩),퍼팩션패드_초대형_20매,프로도기_퍼팩션패드_초대형_20매
89,프로도기,프로도기 강아지 대용량 패키지 노스멜 배변 패드 베이비파우더향 120매 - XL x 1개 420053,노스멜패드,프로도기_노스멜패드
90,프로도기,프로도기 노스멜 배변패드 중형 대용량 200매 - UnKnown,노스멜패드,프로도기_노스멜패드
91,프로도기,프로도기 강아지 퍼펙션 배변패드 카모마일 향 - UnKnown,퍼팩션패드_초대형_20매,프로도기_퍼팩션패드_초대형_20매
92,프로도기,프로도기 트레이닝 강아지 배변 패드 30매 - UnKnown,트레이닝패드,프로도기_트레이닝패드
93,프로도기,[프로도기] 노스멜패드 소형 50매 (향 선택),노스멜패드,프로도기_노스멜패드
94,프로도기,[프로도기] 아로마패드 M 50매 (향 선택),아로마패드_50매_중형,프로도기_아로마패드_50매_중형
95,프로도기,[프로도기] 퍼펙션패드 XXL 20매 (향 선택),퍼팩션패드_초대형_20매,프로도기_퍼팩션패드_초대형_20매
96,프로도기,[프로도기] 노스멜패드 중형 200매 대용량 패키지 (향 선택),노스멜패드,프로도기_노스멜패드
97,프로도기,[프로도기] 트레이닝패드 XL 30매 / 배변훈련패드,트레이닝패드,프로도기_트레이닝패드
98,프로도기,[프로도기] 노스멜패드 대형 120매 대용량 패키지 (향 선택),노스멜패드_대형_30매,프로도기_노스멜패드_대형_30매
99,프로도기,프로도기 노스멜 배변패드 베이비파우더향 30매,노스멜패드,프로도기_노스멜패드
100,프로도기,프로도기 강아지 대용량 패키지 노스멜 배변 패드 베이비파우더향 120매 - UnKnown,노스멜패드_대형_30매,프로도기_노스멜패드_대형_30매
101,프로도기,[프로도기] 프로도기 퍼펙션 패드 캐모마일향 XXL 100g 20매 4개,퍼팩션패드_초대형_20매,프로도기_퍼팩션패드_초대형_20매
102,프로도기,프로도기 트레이닝패드 L 30매 / 강아지배변패드/애견패드,트레이닝패드,프로도기_트레이닝패드
103,프로도기,프로도기 강아지 퍼펙션 배변패드 베이비파우더 향 20매 - UnKnown,퍼팩션패드_초대형_20매,프로도기_퍼팩션패드_초대형_20매
104,프로도기,프로도기 노스멜 배변패드 그린티향 30매 - UnKnown,노스멜패드_대형_30매,프로도기_노스멜패드_대형_30매
105,프로도기,프로도기 트레이닝패드 L 120매 30매 x 4개 배변훈련패드 186078,트레이닝패드,프로도기_트레이닝패드
106,프로도기,프로도기 강아지 배변패드 노스멜패드 소형 200매 50매 x 4팩 - UnKnown,노스멜패드,프로도기_노스멜패드
107,프로도기,프로도기 노스멜 배변패드 그린티향 50매 - UnKnown,노스멜패드,프로도기_노스멜패드
108,프로도기,프로도기 아로마 패드 XL 120매 30매x4개 향 선택 /강아지 배변패드,아로마패드,프로도기_아로마패드
109,프로도기,프로도기 퍼펙션패드 XL 20매 향 선택 /강아지배변패드,퍼팩션패드_초대형_20매,프로도기_퍼팩션패드_초대형_20매
110,프로도기,프로도기 아로마 패드 XL 90매 30매x3개 향 선택 /강아지 배변패드,아로마패드,프로도기_아로마패드
111,프로도기,프로도기 노스멜패드 중형 50매 향 선택 /강아지배변패드,노스멜패드,프로도기_노스멜패드
112,프로도기,프로도기 아로마 패드 XL 30매 향 선택 /강아지 배변패드,아로마패드,프로도기_아로마패드
113,프로도기,프로도기 배변유도제 함유 트레이닝 강아지배변패드 XL 특대형 (120매),트레이닝패드,프로도기_트레이닝패드
114,프로도기,프로도기 트레이닝패드 XL 대용량 120매,트레이닝패드,프로도기_트레이닝패드
115,프로도기,프로도기 강아지 배변패드 트레이닝패드 XL 30매,트레이닝패드,프로도기_트레이닝패드
116,프로도기,프로도기 강아지 배변패드 트레이닝패드 L 30매,트레이닝패드,프로도기_트레이닝패드
117,프로도기,프로도기 노스멜 배변패드 베이비파우더향 30매 - UnKnown,노스멜패드_대형_30매,프로도기_노스멜패드_대형_30매
118,프로도기,프로도기 퍼펙션 패드 XL 80매 20매 x 4개 향 선택,퍼팩션패드_초대형_20매,프로도기_퍼팩션패드_초대형_20매
119,프로도기,프로도기 강아지 배변패드 퍼펙션패드 XXL 40매 20매 x 2팩,퍼팩션패드_초대형_20매,프로도기_퍼팩션패드_초대형_20매
120,프로도기,프로도기 강아지 배변패드 노스멜패드 대형 30매,노스멜패드_대형_30매,프로도기_노스멜패드_대형_30매
121,프로도기,프로도기 강아지 배변패드 노스멜패드 소형 200매 50매 x 4팩,노스멜패드,프로도기_노스멜패드
122,프로도기,프로도기 강아지 배변패드 노스멜패드 중형 대용량 패키지 200매,노스멜패드,프로도기_노스멜패드
123,프로도기,프로도기 아로마패드 소형 화이트머스크 50매 4개세트 강아지배변패드 멍냥보감 픽 1021453,아로마패드_50매_중형,프로도기_아로마패드_50매_중형
124,프로도기,프로도기 강아지 배변패드 아로마패드 M 50매,아로마패드_50매_중형,프로도기_아로마패드_50매_중형
125,프로도기,프로도기 노스멜패드 소형 50매 향 선택 강아지배변패드,노스멜패드,프로도기_노스멜패드
126,프로도기,프로도기 퍼펙션패드 XXL 20매 향 선택 강아지배변패드,퍼팩션패드_초대형_20매,프로도기_퍼팩션패드_초대형_20매
127,프로도기,프로도기 노스멜패드 대형 30매 향 선택 강아지배변패드,노스멜패드_대형_30매,프로도기_노스멜패드_대형_30매
128,프로도기,프로도기 아로마 패드 M 50매 향 선택 강아지 배변패드,아로마패드_50매_중형,프로도기_아로마패드_50매_중형
129,프로도기,프로도기 퍼펙션패드 XXL 40매 20매 x 2개 향 선택,퍼팩션패드_초대형_20매,프로도기_퍼팩션패드_초대형_20매
130,프로도기,프로도기 퍼펙션 패드 XL 40매 20매 x 2개 향 선택,퍼팩션패드_초대형_20매,프로도기_퍼팩션패드_초대형_20매
131,프로도기,프로도기 노스멜 배변패드 소형 100매 50매 x 2개,노스멜패드,프로도기_노스멜패드
132,프로도기,프로도기 트레이닝패드 XL 30매 강아지배변패드애견패드,트레이닝패드,프로도기_트레이닝패드
133,프로도기,프로도기 강아지 배변패드 노스멜패드 소형 100매 50매 x 2팩,노스멜패드,프로도기_노스멜패드
134,프로도기,[프로도기] 프로도기 노스멜 패드 베이비파우더향 L 45g 50매,노스멜패드,프로도기_노스멜패드
135,프로도기,프로도기 노스멜 배변패드 소형 베이비파우더향 50매 2개세트 멍냥보감 픽,노스멜패드,프로도기_노스멜패드
136,프로도기,프로도기 노스멜 배변패드 소형 M 베이비파우더향 50매 2개세트 멍냥보감 픽,노스멜패드,프로도기_노스멜패드
137,프로도기,프로도기 퍼펙션패드 베이비파우더향 특대형 XXL 20매 강아지배변패드 멍냥보감 픽,퍼팩션패드_초대형_20매,프로도기_퍼팩션패드_초대형_20매
138,프로도기,프로도기 아로마패드 소형 M 히노키 50매 4개세트 강아지배변패드 멍냥보감 픽,아로마패드_50매_중형,프로도기_아로마패드_50매_중형
139,프로도기,프로도기 아로마패드 소형 M 히노키 50매 6개세트 강아지배변패드 멍냥보감 픽,아로마패드_50매_중형,프로도기_아로마패드_50매_중형
140,프로도기,프로도기 퍼펙션패드 카모마일향 특대형 XXL 20매 강아지배변패드 멍냥보감 픽,퍼팩션패드_초대형_20매,프로도기_퍼팩션패드_초대형_20매
141,프로도기,프로도기 퍼펙션 패드 대형 20매 카모마일향 강아지배변패드 멍냥보감 픽,퍼팩션패드_초대형_20매,프로도기_퍼팩션패드_초대형_20매
142,프로도기,프로도기 퍼펙션 패드 대형 XL 20매 카모마일향 강아지배변패드 멍냥보감 픽,퍼팩션패드_초대형_20매,프로도기_퍼팩션패드_초대형_20매
143,프로도기,프로도기 아로마패드 소형 화이트머스크 50매 4개세트 강아지배변패드 멍냥보감 픽,아로마패드_50매_중형,프로도기_아로마패드_50매_중형
144,프로도기,프로도기 아로마패드 소형 M 화이트머스크 50매 6개세트 강아지배변패드 멍냥보감 픽,아로마패드_50매_중형,프로도기_아로마패드_50매_중형
145,프로도기,프로도기 아로마패드 강아지배변패드 대형 XL 히노키 30매 4개세트,아로마패드,프로도기_아로마패드
146,프로도기,프로도기 퍼펙션 패드 캐모마일향 XXL 100g 20매 4개,퍼팩션패드_초대형_20매,프로도기_퍼팩션패드_초대형_20매
147,프로도기,프로도기 노스멜 패드 베이비파우더향 L 45g 50매,노스멜패드,프로도기_노스멜패드
148,프로도기,프로도기 배변패드 에필 노스멜 M 50매,노스멜패드,프로도기_노스멜패드
149,프레셔스펫,더조은 프리미엄 애견 배변패드 70g 30매 75x60cm 프레셔스펫 129814,프레셔패드70g,프레셔스펫_프레셔패드70g
150,프레셔스펫,더조은 프리미엄 애견 배변패드 20g 100매 40x50cm 프레셔스펫 129813,프레셔패드20g,프레셔스펫_프레셔패드20g
151,풉,풉 패드 대형 40매 (60x75cm),풀패드대형,풉_풀패드대형
152,풉,풉 패드 소형 100매 (40x50cm),풀패드소형,풉_풀패드소형
153,풉,[체험팩] 풉 패드 소형 2매 (40x50cm),풀패드소형,풉_풀패드소형
154,풉,[체험팩] 풉 패드 대형 2매 (60x75cm),풀패드대형,풉_풀패드대형
155,포라,퍼피패드 대형 30매 강아지대형패드,애견패드대형30매,포라_애견패드대형30매
156,포라,애견용변패드 50매 8개 애견배변패드,애견패드대형50매,포라_애견패드대형50매
157,포라,특대형 빅패드30매 6개 대형견배변패드,애견패드대형30매,포라_애견패드대형30매
158,포라,50매 4개 그린포장 강아지패드 소변패드,애견패드대형50매,포라_애견패드대형50매
159,포라,50매 4개 블루포장 강아지화장실 강아지패드,애견패드대형50매,포라_애견패드대형50매
160,포라,50매 8개 블루포장 강아지배변패드 애견패드,애견패드대형50매,포라_애견패드대형50매
161,포라,퍼피 배변패드 대형 30매 반려견 강아지 애견 소변,애견패드대형30매,포라_애견패드대형30매
162,포라,퍼피패드 라이트 100매 강아지배변판 강아지소변패드,댕댕이패드,포라_댕댕이패드
163,포라,특대형 패드 30P 80cm 54cm 배변패드특대형,애견패드대형30매,포라_애견패드대형30매
164,포라,퍼피패드 50매 4개 1박스 강아지화장실 강아지배변판,애견패드대형50매,포라_애견패드대형50매
165,포라,퍼피 배변패드 50매 4개 1박스 강아지 화장실 애완견,애견패드대형50매,포라_애견패드대형50매
166,포라,애견 용변 배변패드 50매 8개 강아지 화장실 애완견 소변,애견패드대형50매,포라_애견패드대형50매
167,포라,퍼피 배변패드 라이트 100매 강아지 화장실 반려견 배변판,댕댕이패드,포라_댕댕이패드
168,포라,댕댕이패드 100매 6개 1박스 20g 43 53cm 애완견배변패드,댕댕이패드,포라_댕댕이패드
169,포라,트레이닝 애견 배변패드 대형 30매 60x75cm 강아지 애완견 소변,애견패드대형30매,포라_애견패드대형30매
170,포라,트레이닝 애견패드 대형 30매 60x75cm 강아지배변패드 강아지배변판,애견패드대형30매,포라_애견패드대형30매
171,포라,댕댕이 배변패드 100매 6개 1박스 20g 43 53cm 강아지 소변 배변판,댕댕이패드,포라_댕댕이패드
172,펫후,[오늘만 1+1] 펫후 강아지 프리미엄 블랙 배변패드 소형 50매 + 초대형 20매,[오늘만 1+1] 펫후 강아지 프리미엄 블랙 배변패드 소형 50매 + 초대형 20매,펫후_[오늘만 1+1] 펫후 강아지 프리미엄 블랙 배변패드 소형 50매 + 초대형 20매
173,펫티브,강아지 우리아이 배변패드 15g 100매 애견 화장실,우리아이배변패드15g,펫티브_우리아이배변패드15g
174,펫티브,강아지 우리아이 배변패드 20g 100매 애견 화장실,우리아이배변패드20g,펫티브_우리아이배변패드20g
175,펫티브,강아지 우리아이 배변패드 20g 100매 애견 화장실,우리아이배변패드20g,펫티브_우리아이배변패드20g
176,펫티브,강아지 우리아이 배변패드 20g 100매 애견 화장실,우리아이배변패드20g,펫티브_우리아이배변패드20g
